{
  "slug": "nvidia",
  "aliases": [],
  "title": "NVIDIA",
  "sourceUrl": "https://www.nvidia.com/",
  "category": "Media & Consumer Tech",
  "description": "GPU computing system with green-black energy, technical content, and high-performance product pages.",
  "bestFor": "AI hardware, compute platforms, technical product launches, and partner pages."
}
