{
  "slug": "coinbase",
  "aliases": [],
  "title": "Coinbase",
  "sourceUrl": "https://www.coinbase.com/",
  "category": "Fintech & Crypto",
  "description": "Crypto finance system with clean blue identity, institutional calm, and layered product cards.",
  "bestFor": "Fintech apps, wallet flows, trading dashboards, and trusted onboarding."
}
