{
  "slug": "cursor",
  "aliases": [],
  "title": "Cursor",
  "sourceUrl": "https://cursor.com/",
  "category": "Developer Tools & IDEs",
  "description": "AI code editor system with warm editorial canvas, orange actions, and code timeline visuals.",
  "bestFor": "IDE products, AI coding tools, developer workflows, and product demos."
}
