{
  "slug": "together.ai",
  "aliases": [],
  "title": "Together AI",
  "sourceUrl": "https://www.together.ai/",
  "category": "AI & LLM Platforms",
  "description": "Open-source AI infrastructure system with dark hero bands, gradients, and technical docs structure.",
  "bestFor": "AI infrastructure, model APIs, research pages, and developer platforms."
}
