{
  "slug": "slack",
  "aliases": [],
  "title": "Slack",
  "sourceUrl": "https://slack.com/",
  "category": "Tree-only upstream item",
  "description": "Workplace messaging system with aubergine brand color, cream-lavender surfaces, and pill CTAs.",
  "bestFor": "Team communication, collaboration tools, onboarding, and messaging products."
}
