{
  "slug": "playstation",
  "aliases": [],
  "title": "PlayStation",
  "sourceUrl": "https://www.playstation.com/",
  "category": "Media & Consumer Tech",
  "description": "Gaming retail system with channel-style surfaces, cyan interaction, and product imagery.",
  "bestFor": "Game stores, console pages, entertainment commerce, and immersive product hubs."
}
