{
  "slug": "hp",
  "aliases": [],
  "title": "HP",
  "sourceUrl": "https://www.hp.com/",
  "category": "Media & Consumer Tech",
  "description": "PC and printer system with white canvas, HP blue CTAs, geometric type, and angular motifs.",
  "bestFor": "Hardware commerce, support portals, enterprise product pages, and device catalogs."
}
