{
  "slug": "airbnb",
  "aliases": [],
  "title": "Airbnb",
  "sourceUrl": "https://www.airbnb.com/",
  "category": "E-commerce & Retail",
  "description": "Travel marketplace system with warm coral actions, photography-led cards, and rounded booking UI.",
  "bestFor": "Marketplaces, booking flows, listing grids, and hospitality products."
}
