{
  "slug": "clickhouse",
  "aliases": [],
  "title": "ClickHouse",
  "sourceUrl": "https://clickhouse.com/",
  "category": "Backend, Database & DevOps",
  "description": "Analytics database system with black canvas, electric yellow accents, and code-heavy cards.",
  "bestFor": "Database products, analytics infrastructure, documentation, and technical launches."
}
