{
  "slug": "webflow",
  "aliases": [],
  "title": "Webflow",
  "sourceUrl": "https://webflow.com/",
  "category": "Design & Creative Tools",
  "description": "Visual web-builder system with black-white contrast and multi-color product-category accents.",
  "bestFor": "Website builders, design platforms, no-code products, and launch pages."
}
