{
  "slug": "vercel",
  "aliases": [],
  "title": "Vercel",
  "sourceUrl": "https://vercel.com/",
  "category": "Developer Tools & IDEs",
  "description": "Frontend platform system with black-white precision, Geist typography, and code-forward product surfaces.",
  "bestFor": "Developer platforms, docs, deployment flows, and infrastructure dashboards."
}
