{
  "slug": "runwayml",
  "aliases": [],
  "title": "Runway",
  "sourceUrl": "https://runwayml.com/",
  "category": "AI & LLM Platforms",
  "description": "AI creative-tools system with cinematic dark heroes, paper-white reading bands, and filmic pacing.",
  "bestFor": "Creative AI tools, media platforms, video products, and editorial showcases."
}
