{
  "slug": "tesla",
  "aliases": [],
  "title": "Tesla",
  "sourceUrl": "https://www.tesla.com/",
  "category": "Automotive",
  "description": "Electric vehicle system with radical subtraction, cinematic photography, and minimal chrome.",
  "bestFor": "EV pages, configurators, product launches, and direct-to-consumer commerce."
}
