{
  "slug": "composio",
  "aliases": [],
  "title": "Composio",
  "sourceUrl": "https://composio.dev/",
  "category": "Backend, Database & DevOps",
  "description": "AI integration platform with dark technical surfaces, blue voltage, and terminal-style mockups.",
  "bestFor": "Agent tooling, API integrations, developer dashboards, and docs pages."
}
