{
  "slug": "wise",
  "aliases": [],
  "title": "Wise",
  "sourceUrl": "https://wise.com/",
  "category": "Fintech & Crypto",
  "description": "Money-transfer system with lime-green accents, heavy display type, and sage-tinted surfaces.",
  "bestFor": "Fintech products, international payments, consumer banking, and pricing explainers."
}
