{
  "slug": "cohere",
  "aliases": [],
  "title": "Cohere",
  "sourceUrl": "https://cohere.com/",
  "category": "AI & LLM Platforms",
  "description": "Enterprise AI system with editorial white space, mineral surfaces, and data-rich product bands.",
  "bestFor": "AI platforms, enterprise search, model pages, and research-to-product narratives."
}
