{
  "slug": "opencode.ai",
  "aliases": [],
  "title": "OpenCode AI",
  "sourceUrl": "https://opencode.ai/",
  "category": "AI & LLM Platforms",
  "description": "AI coding platform with developer-centric dark surfaces and code-first interaction patterns.",
  "bestFor": "AI coding products, agent tools, IDE extensions, and technical launch pages."
}
