{
  "slug": "theverge",
  "aliases": [],
  "title": "The Verge",
  "sourceUrl": "https://www.theverge.com/",
  "category": "Media & Consumer Tech",
  "description": "Tech editorial system with acid accents, bold display type, and dense media layouts.",
  "bestFor": "Editorial media, tech news, magazine surfaces, and content-rich homepages."
}
