{
  "slug": "meta",
  "aliases": [],
  "title": "Meta",
  "sourceUrl": "https://www.meta.com/",
  "category": "E-commerce & Retail",
  "description": "Consumer-tech retail system with product photography, binary surfaces, and Meta Blue CTAs.",
  "bestFor": "Hardware stores, device configurators, product education, and consumer launches."
}
