{
  "slug": "mistral.ai",
  "aliases": [],
  "title": "Mistral AI",
  "sourceUrl": "https://mistral.ai/",
  "category": "AI & LLM Platforms",
  "description": "Open-weight AI system with engineered minimalism, purple tones, and precise technical surfaces.",
  "bestFor": "Model labs, research products, technical docs, and AI platform pages."
}
