{
  "slug": "uber",
  "aliases": [],
  "title": "Uber",
  "sourceUrl": "https://www.uber.com/",
  "category": "Media & Consumer Tech",
  "description": "Mobility system with black-white restraint, tight type, urban imagery, and pill controls.",
  "bestFor": "Mobility apps, marketplace onboarding, logistics tools, and urban services."
}
