{
  "slug": "minimax",
  "aliases": [],
  "title": "Minimax",
  "sourceUrl": "https://www.minimaxi.com/",
  "category": "AI & LLM Platforms",
  "description": "AI model provider system with stark white marketing, black CTAs, and vivid model cards.",
  "bestFor": "Model providers, AI product catalogs, docs grids, and pricing pages."
}
