{
  "slug": "resend",
  "aliases": [],
  "title": "Resend",
  "sourceUrl": "https://resend.com/",
  "category": "Productivity & SaaS",
  "description": "Email API system with minimal dark surfaces, monospace accents, and developer-grade restraint.",
  "bestFor": "Email APIs, devtools, transactional products, and docs-led landing pages."
}
