{
  "slug": "notion",
  "aliases": [],
  "title": "Notion",
  "sourceUrl": "https://www.notion.com/",
  "category": "Productivity & SaaS",
  "description": "Workspace system with warm minimalism, serif display moments, and soft document-like surfaces.",
  "bestFor": "Knowledge bases, docs tools, workspace apps, and editorial product surfaces."
}
